{
  "$schema": "https://json-schema.org/draft/2020-12/schema",
  "title": "house.json",
  "description": "Per-repo manifest for the house conventions package. A why is required for disabling a default-on module, a branchPolicy other than pr, each carve-out, and a maxCoLoadLines above the default (kind coload-ceiling, with an integer ceiling equal to the value). Enabling a default-off module is configuration, not deviation.",
  "type": "object",
  "required": ["version", "defaultBranch", "branchPolicy", "modules"],
  "additionalProperties": false,
  "properties": {
    "version": { "type": "string", "pattern": "^\\d+\\.\\d+\\.\\d+$", "description": "Written by house render --apply from the plugin's plugin.json, never by hand." },
    "defaultBranch": { "type": "string", "minLength": 1 },
    "branchPolicy": { "enum": ["pr", "direct"], "description": "direct requires a deviations entry with a why." },
    "protectedBranches": { "type": "array", "items": { "type": "string", "minLength": 1 }, "default": ["master", "main"] },
    "carveOuts": { "type": "array", "items": { "type": "string", "minLength": 1 }, "description": "Glob list (shell case semantics; * crosses /). Every changed path must match one for a protected-branch commit to pass. Each entry requires a deviations row." },
    "guard": {
      "type": "object",
      "required": ["by", "decided", "why"],
      "additionalProperties": false,
      "description": "Dated record of what supplies this repo's branch guard (ADR 0009, #246). Accepted by the checker's guard family as the reachable guard; never read by the hook itself as a stand-down signal.",
      "properties": {
        "by": { "enum": ["plugin", "floor", "remote"], "description": "plugin: the installed plugin supplies the hook (solo repo). floor: the vendored git hooks plus remote branch protection (team repo; the checker requires the floor to be vendored). remote: the server alone (the checker cannot see branch protection)." },
        "decided": { "type": "string", "pattern": "^\\d{4}-\\d{2}-\\d{2}$" },
        "why": { "type": "string", "minLength": 1 }
      }
    },
    "targets": {
      "type": "array",
      "items": { "enum": ["claude-code", "codex", "gemini"] },
      "uniqueItems": true,
      "contains": { "const": "claude-code" },
      "default": ["claude-code"],
      "description": "Agents this repo's rules are rendered for (ADR 0015). Absent means [\"claude-code\"], which must be present. codex or gemini makes render write a house-managed block into the root AGENTS.md; gemini also needs GEMINI.md to import AGENTS.md (render scaffolds it) or .gemini/settings.json context.fileName to name it."
    },
    "modules": {
      "type": "object",
      "additionalProperties": {
        "type": "object",
        "required": ["enabled"],
        "additionalProperties": false,
        "properties": {
          "enabled": { "type": "boolean" },
          "config": { "type": "object" },
          "confirmed": {
            "type": "object",
            "additionalProperties": { "type": "string", "pattern": "^\\d{4}-\\d{2}-\\d{2}$" },
            "description": "At-adoption steps confirmed by hand, step id (from the module's atAdoption) to the date confirmed. Written by `house confirm <module> <step-id>`; `house doctor` lists the steps still open."
          }
        }
      }
    },
    "deviations": {
      "type": "array",
      "items": {
        "type": "object",
        "required": ["kind", "what", "why", "decided"],
        "additionalProperties": false,
        "properties": {
          "kind": { "enum": ["disabled-module", "branch-policy", "carve-out", "unmanaged-file", "coload-ceiling", "declined-step", "other"] },
          "module": { "type": "string", "description": "Required for kind declined-step." },
          "step": { "type": "string", "pattern": "^[a-z0-9]+(-[a-z0-9]+)*$", "description": "Required for kind declined-step: the at-adoption step id the module declares. Written by `house decline <module> <step-id> --why \"...\"`; `house doctor` lists the step as declined rather than not confirmed." },
          "ceiling": { "type": "integer", "minimum": 1 },
          "what": { "type": "string", "minLength": 1 },
          "why": { "type": "string", "minLength": 1 },
          "decided": { "type": "string", "pattern": "^\\d{4}-\\d{2}-\\d{2}$" }
        }
      }
    },
    "ratchet": { "type": "object", "additionalProperties": { "type": "integer", "minimum": 1 }, "description": "Per-file line ceilings, generated by render from live counts, auto-tightened on shrink, never hand-typed. CLAUDE.md is not eligible." },
    "ratchetRaises": {
      "type": "array",
      "items": {
        "type": "object",
        "required": ["path", "from", "to", "why", "decided"],
        "additionalProperties": false,
        "properties": {
          "path": { "type": "string" }, "from": { "type": "integer", "description": "The file's ratchet entry, or its configured line limit when it has none; a raise over the line limit applies only while it matches." }, "to": { "type": "integer" },
          "why": { "type": "string", "minLength": 1 }, "decided": { "type": "string", "pattern": "^\\d{4}-\\d{2}-\\d{2}$" }
        }
      }
    }
  }
}
