{
  "version": "0.22.5",
  "defaultBranch": "main",
  "branchPolicy": "pr",
  "protectedBranches": [
    "master",
    "main"
  ],
  "guard": {
    "by": "plugin",
    "decided": "2026-08-31",
    "why": "the user-scope house-rules plugin supplies the PreToolUse hook; no repo-local copy is kept so the two cannot drift"
  },
  "targets": [
    "claude-code",
    "codex",
    "gemini"
  ],
  "modules": {
    "claude-code": {
      "enabled": true,
      "config": {
        "claudeWorkflowGlobs": []
      }
    },
    "data-pipelines": {
      "enabled": false,
      "config": {
        "pipelineGlobs": []
      }
    },
    "database": {
      "enabled": false,
      "config": {}
    },
    "deployment": {
      "enabled": false,
      "config": {
        "deployGlobs": []
      }
    },
    "docs": {
      "enabled": true,
      "config": {
        "roots": [],
        "excludeFiles": [
          "plugins/house/modules/**",
          "plugins/house/templates/**",
          "plugins/house/skills/**",
          "plugins/house/evals/**",
          {
            "path": "plugins/house/agents/**",
            "why": "subagent definitions the harness loads; their tokens name tools and models, not this tree"
          },
          {
            "path": "plugins/house/orchestration/**",
            "why": "session-start context the hook injects; its tokens name agents and tiers, not this tree"
          },
          {
            "path": "docs/handbook/sources/**",
            "why": "package-authored survey material; its tokens describe surveyed repos, not this tree"
          },
          {
            "path": "research/**",
            "why": "point-in-time research records kept verbatim; their tokens describe surveyed repos and past states, not this tree"
          },
          "docs/handbook/claude-code.md",
          "docs/handbook/conventions.md",
          "docs/handbook/data-pipelines.md",
          "docs/handbook/database.md",
          "docs/handbook/deployment.md",
          "docs/handbook/docs.md",
          "docs/handbook/llm-output.md",
          "docs/decisions/0004-archive-tier-scanned-by-per-repo-flag.md",
          "docs/decisions/0007-path-scoped-rules-load-on-read.md"
        ],
        "archiveDirs": [],
        "scanArchive": true,
        "haystackDirs": [
          "scripts",
          "package.json",
          ".github/workflows",
          "plugins/house/scripts",
          "plugins/house/payload",
          "plugins/house/hooks",
          "plugins/house/schema"
        ],
        "extraPathRoots": [],
        "packageRoots": [],
        "buildArtifactPrefixes": [],
        "classPrefixes": [],
        "componentSuffixes": [],
        "componentAllowlist": [],
        "bareScriptAllowlist": [
          "check:docs",
          "check:house",
          "prebuild",
          "postbuild"
        ],
        "lengthLimits": {
          "CLAUDE.md": 40,
          "README.md": 160,
          ".claude/rules/house/*.md": 200,
          "plugins/house/orchestration/ORCHESTRATION.md": {
            "bytes": 9500
          }
        },
        "maxCoLoadLines": 400,
        "emDash": {
          "mode": "all",
          "paths": [
            "README.md",
            "CHANGELOG.md",
            "docs/**/*.md"
          ],
          "exclude": [
            {
              "path": "docs/handbook/sources/**",
              "why": "point-in-time research notes kept verbatim"
            }
          ]
        }
      }
    },
    "engineering": {
      "enabled": true,
      "config": {
        "codeGlobs": [],
        "gateGlobs": []
      }
    },
    "evals": {
      "enabled": true,
      "config": {
        "evalGlobs": [
          "plugins/house/evals/**"
        ]
      }
    },
    "github": {
      "enabled": true,
      "config": {
        "actionsBudgetMinutes": null,
        "secretGlobs": [],
        "waivers": [
          {
            "check": "codeowners",
            "why": "solo repo: github.md asks for code owners once there is a second maintainer, and until then there is nobody to route a review to"
          }
        ]
      },
      "confirmed": {
        "push-protection": "2026-10-21",
        "head-branch-deletion": "2026-10-21",
        "branch-protection": "2026-10-21",
        "multi-factor": "2026-10-21",
        "community-profile": "2026-10-21"
      }
    },
    "llm-output": {
      "enabled": false,
      "config": {
        "llmGlobs": []
      }
    },
    "retrieval": {
      "enabled": false,
      "config": {}
    },
    "security": {
      "enabled": true,
      "config": {},
      "confirmed": {
        "code-scanning": "2026-10-21",
        "branch-protection": "2026-10-21",
        "credential-deny": "2026-10-21"
      }
    },
    "testing": {
      "enabled": true,
      "config": {
        "testGlobs": [
          "tests/**"
        ],
        "gateGlobs": [
          ".github/workflows/**"
        ]
      }
    }
  },
  "ratchet": {
    "README.md": 188
  },
  "ratchetRaises": [
    {
      "path": "README.md",
      "from": 60,
      "to": 120,
      "why": "the public README now has to carry positioning, prerequisites, versioning policy, and licensing for a reader who has never seen this package, which does not fit in 60 lines",
      "decided": "2026-09-02"
    },
    {
      "path": "README.md",
      "from": 120,
      "to": 160,
      "why": "a public README carries positioning, prerequisites, licensing, contributing pointers, and acknowledgements that the private one did not, and 160 leaves headroom so each honest addition does not renegotiate the budget",
      "decided": "2026-09-02"
    },
    {
      "path": "README.md",
      "from": 160,
      "to": 190,
      "why": "the README now carries the pinned install, how to move a pin, and what the hooks run (#133), none of which an adopter can get from the install prompt",
      "decided": "2026-10-03"
    }
  ],
  "deviations": [
    {
      "kind": "declined-step",
      "module": "security",
      "step": "code-owners",
      "what": "Declined at-adoption step `code-owners`: Once there is a second maintainer, add a code-owners entry naming a reviewer for workflow, release, and agent config files.",
      "why": "Solo maintainer: dubbl-a is the only collaborator. Add a code-owners entry when a second maintainer joins.",
      "decided": "2026-10-21"
    }
  ]
}
